aiter/ops/triton/configs/gemm/gfx950-GEMM-A16WFP4_PRESHUFFLED.json
{
  "small": {
    "BLOCK_SIZE_M": 4,
    "BLOCK_SIZE_N": 128,
    "BLOCK_SIZE_K": 512,
    "GROUP_SIZE_M": 1,
    "num_warps": 4,
    "num_stages": 1,
    "waves_per_eu": 2,
    "matrix_instr_nonkdim": 16,
    "cache_modifier": ".cg",
    "NUM_KSPLIT": 1
  },
  "small_M16": {
    "BLOCK_SIZE_M": 4,
    "BLOCK_SIZE_N": 128,
    "BLOCK_SIZE_K": 512,
    "GROUP_SIZE_M": 1,
    "num_warps": 4,
    "num_stages": 1,
    "waves_per_eu": 2,
    "matrix_instr_nonkdim": 16,
    "cache_modifier": ".cg",
    "NUM_KSPLIT": 1
  },
  "medium_M32": {
    "BLOCK_SIZE_M": 8,
    "BLOCK_SIZE_N": 128,
    "BLOCK_SIZE_K": 512,
    "GROUP_SIZE_M": 1,
    "num_warps": 8,
    "num_stages": 1,
    "waves_per_eu": 2,
    "matrix_instr_nonkdim": 16,
    "cache_modifier": ".cg",
    "NUM_KSPLIT": 1
  },
  "medium_M64": {
    "BLOCK_SIZE_M": 8,
    "BLOCK_SIZE_N": 128,
    "BLOCK_SIZE_K": 512,
    "GROUP_SIZE_M": 1,
    "num_warps": 8,
    "num_stages": 1,
    "waves_per_eu": 2,
    "matrix_instr_nonkdim": 16,
    "cache_modifier": ".cg",
    "NUM_KSPLIT": 1
  },
  "medium_M128": {
    "BLOCK_SIZE_M": 8,
    "BLOCK_SIZE_N": 128,
    "BLOCK_SIZE_K": 512,
    "GROUP_SIZE_M": 1,
    "num_warps": 8,
    "num_stages": 1,
    "waves_per_eu": 2,
    "matrix_instr_nonkdim": 16,
    "cache_modifier": ".cg",
    "NUM_KSPLIT": 1
  },
  "large": {
    "BLOCK_SIZE_M": 8,
    "BLOCK_SIZE_N": 128,
    "BLOCK_SIZE_K": 512,
    "GROUP_SIZE_M": 1,
    "num_warps": 8,
    "num_stages": 1,
    "waves_per_eu": 2,
    "matrix_instr_nonkdim": 16,
    "cache_modifier": ".cg",
    "NUM_KSPLIT": 1
  }, 
   "xlarge": {
    "BLOCK_SIZE_M": 8,
    "BLOCK_SIZE_N": 128,
    "BLOCK_SIZE_K": 512,
    "GROUP_SIZE_M": 1,
    "num_warps": 8,
    "num_stages": 1,
    "waves_per_eu": 2,
    "matrix_instr_nonkdim": 16,
    "cache_modifier": null,
    "NUM_KSPLIT": 1
  }

}
