aiter/ops/triton/configs/gemm/gfx950-GEMM-A16W16.json
{
    "M_LEQ_64": {
        "BLOCK_SIZE_M": 64,
        "BLOCK_SIZE_N": 128,
        "BLOCK_SIZE_K": 256,
        "GROUP_SIZE_M": 1,
        "num_warps": 8,
        "num_stages": 2,
        "waves_per_eu": 3,
        "matrix_instr_nonkdim": 16,
        "cache_modifier": ".cg",
        "NUM_KSPLIT": 1,
        "kpack": 1
    },
    "M_LEQ_128": {
        "BLOCK_SIZE_M": 128,
        "BLOCK_SIZE_N": 128,
        "BLOCK_SIZE_K": 256,
        "GROUP_SIZE_M": 1,
        "num_warps": 8,
        "num_stages": 2,
        "waves_per_eu": 3,
        "matrix_instr_nonkdim": 16,
        "cache_modifier": ".cg",
        "NUM_KSPLIT": 1,
        "kpack": 1
    },
    "M_LEQ_256": {
        "BLOCK_SIZE_M": 256,
        "BLOCK_SIZE_N": 128,
        "BLOCK_SIZE_K": 128,
        "GROUP_SIZE_M": 1,
        "num_warps": 8,
        "num_stages": 2,
        "waves_per_eu": 2,
        "matrix_instr_nonkdim": 16,
        "cache_modifier": ".cg",
        "NUM_KSPLIT": 1,
        "kpack": 1
    },
    "M_LEQ_512": {
        "BLOCK_SIZE_M": 256,
        "BLOCK_SIZE_N": 256,
        "BLOCK_SIZE_K": 64,
        "GROUP_SIZE_M": 1,
        "num_warps": 8,
        "num_stages": 2,
        "waves_per_eu": 2,
        "matrix_instr_nonkdim": 16,
        "cache_modifier": ".cg",
        "NUM_KSPLIT": 1,
        "kpack": 1
    },
    "M_LEQ_2048": {
        "BLOCK_SIZE_M": 256,
        "BLOCK_SIZE_N": 256,
        "BLOCK_SIZE_K": 64,
        "GROUP_SIZE_M": 1,
        "num_warps": 8,
        "num_stages": 2,
        "waves_per_eu": 2,
        "matrix_instr_nonkdim": 16,
        "cache_modifier": null,
        "NUM_KSPLIT": 1,
        "kpack": 1
    },
    "any": {
        "BLOCK_SIZE_M": 256,
        "BLOCK_SIZE_N": 256,
        "BLOCK_SIZE_K": 32,
        "GROUP_SIZE_M": 6,
        "num_warps": 8,
        "num_stages": 3,
        "waves_per_eu": 2,
        "matrix_instr_nonkdim": 16,
        "cache_modifier": null,
        "NUM_KSPLIT": 1,
        "kpack": 1,
        "env_vars": {
          "TRITON_HIP_USE_ASYNC_COPY": "1"
        }
    }
}
