aiter/ops/triton/configs/gemm/MI350X-FUSED-GEMM-AFP4WFP4-A16W16-N4=512-N16=256-K=7168.json
{
  "small": {
    "BLOCK_SIZE_M": 8,
    "BLOCK_SIZE_N": 16,
    "BLOCK_SIZE_K": 256,
    "GROUP_SIZE_M": 1,
    "num_warps": 2,
    "num_stages": 2,
    "waves_per_eu": 1,
    "matrix_instr_nonkdim": 16,
    "cache_modifier": ".cg",
    "NUM_KSPLIT": 14
  },
  "small_M16": {
    "BLOCK_SIZE_M": 8,
    "BLOCK_SIZE_N": 16,
    "BLOCK_SIZE_K": 512,
    "GROUP_SIZE_M": 1,
    "num_warps": 2,
    "num_stages": 2,
    "waves_per_eu": 2,
    "matrix_instr_nonkdim": 16,
    "cache_modifier": null,
    "NUM_KSPLIT": 8
  },
  "medium_M32": {
    "BLOCK_SIZE_M": 8,
    "BLOCK_SIZE_N": 16,
    "BLOCK_SIZE_K": 256,
    "GROUP_SIZE_M": 1,
    "num_warps": 2,
    "num_stages": 2,
    "waves_per_eu": 1,
    "matrix_instr_nonkdim": 16,
    "cache_modifier": null,
    "NUM_KSPLIT": 7
  },
  "medium_M64": {
    "BLOCK_SIZE_M": 8,
    "BLOCK_SIZE_N": 32,
    "BLOCK_SIZE_K": 256,
    "GROUP_SIZE_M": 1,
    "num_warps": 2,
    "num_stages": 1,
    "waves_per_eu": 2,
    "matrix_instr_nonkdim": 16,
    "cache_modifier": null,
    "NUM_KSPLIT": 7
  },
  "medium_M128": {
    "BLOCK_SIZE_M": 8,
    "BLOCK_SIZE_N": 16,
    "BLOCK_SIZE_K": 256,
    "GROUP_SIZE_M": 1,
    "num_warps": 2,
    "num_stages": 2,
    "waves_per_eu": 4,
    "matrix_instr_nonkdim": 16,
    "cache_modifier": null,
    "NUM_KSPLIT": 4
  },
  "large": {
    "BLOCK_SIZE_M": 8,
    "BLOCK_SIZE_N": 16,
    "BLOCK_SIZE_K": 512,
    "GROUP_SIZE_M": 1,
    "num_warps": 2,
    "num_stages": 2,
    "waves_per_eu": 1,
    "matrix_instr_nonkdim": 16,
    "cache_modifier": null,
    "NUM_KSPLIT": 1
  },
  "xlarge": {
    "BLOCK_SIZE_M": 8,
    "BLOCK_SIZE_N": 32,
    "BLOCK_SIZE_K": 512,
    "GROUP_SIZE_M": 8,
    "num_warps": 2,
    "num_stages": 2,
    "waves_per_eu": 1,
    "matrix_instr_nonkdim": 16,
    "cache_modifier": null,
    "NUM_KSPLIT": 1
  }
}
